### ISSUE TITLE
fileserver throws 404 after upgrade from 3.1.6 to 4.4.6

### ISSUE THREAD

**Issue by thorus90** [haiwen/seafile#1461]
I recently upgraded from 3.1.6 to 4.4.6 now downloading files from the webinterface does not work anymore.

I have a bit a "special" constellation, my apache webserver is on another host, because its behind nat and port 80 and 443 are forwarded to that host.

I'm using http to proxy seafhttp and https to proxy the rest,because of some limitations in mod_proxy I cannot proxy / to one host and /seafhttp to another host

My vhost.conf:

```
 # cat seafile.<MYDOMAIN>.de.conf
<VirtualHost *:80>

        ServerName seafile.<MYDOMAIN>.de

        #
        # seafile httpserver
        #
        ProxyPass /seafhttp http://seafile.<MYDOMAIN>.de:8082/
        ProxyPassReverse /seafhttp http://seafile.<MYDOMAIN>.de:8082/

    LogLevel debug

    RewriteEngine On
        RewriteRule ^/seafhttp - [QSA,L]
    RewriteRule ^/?(.*) https://%{SERVER_NAME}/$1 [R,L]

</VirtualHost>

<VirtualHost *:443>

        ServerName seafile.<MYDOMAIN>.de


        ErrorLog /var/www/seafile.<MYDOMAIN>.de/logs/error_log
        CustomLog /var/www/seafile.<MYDOMAIN>.de/logs/access_log combined

        <Directory "/usr/htdocs">
                AllowOverride All
                Options +ExecCGI -Includes +FollowSymlinks
                Require all granted
        </Directory>

        SSLEngine on
    SSLCertificateFile /etc/apache2/ssl/seafile.<MYDOMAIN>.de/mycert.crt
    SSLCertificateKeyFile /etc/apache2/ssl/seafile.<MYDOMAIN>.de/mykey.key


        ProxyPass / http://seafile.<MYDOMAIN>.de:8000/
        ProxyPassReverse / http://seafile.<MYDOMAIN>.de:8000/

</VirtualHost>
```

My ccnet.conf:
```
 # cat ccnet/ccnet.conf
[General]
USER_NAME = seafile
ID = 2e79b6c8e8834ce32879806ff3b60c1b036f1dc9
NAME = seafile
SERVICE_URL = http://seafile.<MYDOMAIN>.de:8000

[Network]
PORT = 10001

[Client]
PORT = 13418

[Database]
ENGINE = mysql
HOST = mysql.intranet.jr0.de
USER = seafile
PASSWD = XXX
DB = ccnet-db
CONNECTION_CHARSET = utf8
```

My seahub_settings.py:
```
 # cat seahub_settings.py
SECRET_KEY = "XXX"

FILE_SERVER_ROOT = 'http://seafile.<MYDOMAIN>.de/seafhttp/'
DEBUG = True

DATABASES = {
      'default': {
          'ENGINE': 'django.db.backends.mysql',
          'USER' : 'seafile',
          'PASSWORD' : 'XXX',
          'NAME' : 'seahub-db',
          'HOST' : 'mysql.intranet.jr0.de',
          'OPTIONS': {
              "init_command": "SET storage_engine=INNODB",
          }
      }
  }
```

If I click to download a file the correct link gets generated `http://seafile.<MYDOMAIN>.de/seafhttp/files/94f5bd52-90c8-4dcd-bffb-62339bf95ad0/test.ods`. After setting the LogLevel to debug in Apache I can see it gets proxied to the correct Host:

```
[Thu Nov 26 14:39:35.408569 2015] [proxy:debug] [pid 18860:tid 140704026175232] mod_proxy.c(1159): [client 62.96.157.180:45276] AH01143: Running scheme http handler (attempt 0)
[Thu Nov 26 14:39:35.408579 2015] [proxy:debug] [pid 18860:tid 140704026175232] proxy_util.c(2147): AH00942: HTTP: has acquired connection for (seafile.<MYDOMAIN>.de)
[Thu Nov 26 14:39:35.408585 2015] [proxy:debug] [pid 18860:tid 140704026175232] proxy_util.c(2200): [client 62.96.157.180:45276] AH00944: connecting http://seafile.<MYDOMAIN>.de:8082//files/ba5937ea-33a8-43cb-a578-bb2bff4056a0/test.ods to seafile.<MYDOMAIN>.de:8082
[Thu Nov 26 14:39:35.408591 2015] [proxy:debug] [pid 18860:tid 140704026175232] proxy_util.c(2409): [client 62.96.157.180:45276] AH00947: connected //files/ba5937ea-33a8-43cb-a578-bb2bff4056a0/test.ods to seafile.<MYDOMAIN>.de:8082
[Thu Nov 26 14:39:35.409309 2015] [proxy:debug] [pid 18860:tid 140704026175232] proxy_util.c(2162): AH00943: http: has released connection for (seafile.<MYDOMAIN>.de)
```

There you can see it released the http connection, so I sniffed the communication:

```
14:29:02.779654 IP 192.168.100.250.51384 > 192.168.100.247.8082: Flags [P.], seq 1032882107:1032882751, ack 3878813502, win 229, options [nop,nop,TS val 2363012698 ecr 3753832824], length 644
        0x0000:  4500 02b8 9325 4000 4006 59d8 c0a8 64fa  E....%@.@.Y...d.
        0x0010:  c0a8 64f7 c8b8 1f92 3d90 87bb e731 ff3e  ..d.....=....1.>
        0x0020:  8018 00e5 ec10 0000 0101 080a 8cd8 b65a  ...............Z
        0x0030:  dfbe f178 4745 5420 2f2f 6669 6c65 732f  ...xGET.//files/
        0x0040:  3362 3536 3537 3664 2d33 3230 302d 3462  3b56576d-3200-4b
        0x0050:  3936 2d38 3635 632d 3130 3336 6339 3335  96-865c-1036c935
        0x0060:  3239 3966 2f4b 6f73 7465 6e61 7566 7374  299f/tes
        0x0070:  656c 6c75 6e67 2e6f 6473 2048 5454 502f  t.ods.HTTP/
        0x0080:  312e 310d 0a48 6f73 743a 2073 6561 6669  1.1..Host:.seafi
        0x0090:  6c65 2e72 6f74 746d 616e 6e2d 6d6f 6562  le.<MYDOMAIN>
        0x00a0:  656c 2e64 653a 3830 3832 0d0a 5573 6572  .de:8082..User
        0x00b0:  2d41 6765 6e74 3a20 4d6f 7a69 6c6c 612f  -Agent:.Mozilla/
        0x00c0:  352e 3020 2857 696e 646f 7773 204e 5420  5.0.(Windows.NT.
        0x00d0:  362e 313b 2057 4f57 3634 3b20 7276 3a34  6.1;.WOW64;.rv:4
        0x00e0:  312e 3029 2047 6563 6b6f 2f32 3031 3030  1.0).Gecko/20100
        0x00f0:  3130 3120 4669 7265 666f 782f 3431 2e30  101.Firefox/41.0
        0x0100:  0d0a 4163 6365 7074 3a20 7465 7874 2f68  ..Accept:.text/h
        0x0110:  746d 6c2c 6170 706c 6963 6174 696f 6e2f  tml,application/
        0x0120:  7868 746d 6c2b 786d 6c2c 6170 706c 6963  xhtml+xml,applic
        0x0130:  6174 696f 6e2f 786d 6c3b 713d 302e 392c  ation/xml;q=0.9,
        0x0140:  2a2f 2a3b 713d 302e 380d 0a41 6363 6570  */*;q=0.8..Accep
        0x0150:  742d 4c61 6e67 7561 6765 3a20 6465 2c65  t-Language:.de,e
        0x0160:  6e2d 5553 3b71 3d30 2e37 2c65 6e3b 713d  n-US;q=0.7,en;q=
        0x0170:  302e 330d 0a41 6363 6570 742d 456e 636f  0.3..Accept-Enco
        0x0180:  6469 6e67 3a20 677a 6970 2c20 6465 666c  ding:.gzip,.defl
        0x0190:  6174 650d 0a43 6f6f 6b69 653a 2063 7372  ate..Cookie:.csr
        0x01a0:  6674 6f6b 656e 3d46 4b75 5255 6474 4f32  ftoken=FKuRUdtO2
        0x01b0:  4c6f 5a7a 386b 3264 7574 3866 4571 5342  LoZz8k2dut8fEqSB
        0x01c0:  646a 6764 6672 523b 2073 6573 7369 6f6e  djgdfrR;.session
        0x01d0:  6964 3d74 6965 7173 7932 6571 3669 746f  id=tieqsy2eq6ito
        0x01e0:  7968 6c33 3875 3465 3876 3464 6662 7375  yhl38u4e8v4dfbsu
        0x01f0:  6d73 6b0d 0a50 7261 676d 613a 206e 6f2d  msk..Pragma:.no-
        0x0200:  6361 6368 650d 0a43 6163 6865 2d43 6f6e  cache..Cache-Con
        0x0210:  7472 6f6c 3a20 6e6f 2d63 6163 6865 0d0a  trol:.no-cache..
        0x0220:  582d 466f 7277 6172 6465 642d 466f 723a  X-Forwarded-For:
        0x0230:  2036 322e 3936 2e31 3537 2e31 3830 0d0a  .62.96.157.180..
        0x0240:  582d 466f 7277 6172 6465 642d 486f 7374  X-Forwarded-Host
        0x0250:  3a20 7365 6166 696c 652e 726f 7474 6d61  :.seafile.
        0x0260:  6e6e 2d6d 6f65 6265 6c2e 6465 0d0a 582d  <MYDOMAIN>.de..X-
        0x0270:  466f 7277 6172 6465 642d 5365 7276 6572  Forwarded-Server
        0x0280:  3a20 7365 6166 696c 652e 726f 7474 6d61  :.seafile.
        0x0290:  6e6e 2d6d 6f65 6265 6c2e 6465 0d0a 436f  <MYDOMAIN>.de..Co
        0x02a0:  6e6e 6563 7469 6f6e 3a20 4b65 6570 2d41  nnection:.Keep-A
        0x02b0:  6c69 7665 0d0a 0d0a                      live....
14:29:02.779824 IP 192.168.100.247.8082 > 192.168.100.250.51384: Flags [P.], seq 1:46, ack 644, win 306, options [nop,nop,TS val 3753955447 ecr 2363012698], length 45
        0x0000:  4500 0061 f85f 4000 4006 f6f4 c0a8 64f7  E..a._@.@.....d.
        0x0010:  c0a8 64fa 1f92 c8b8 e731 ff3e 3d90 8a3f  ..d......1.>=..?
        0x0020:  8018 0132 4b96 0000 0101 080a dfc0 d077  ...2K..........w
        0x0030:  8cd8 b65a 4854 5450 2f31 2e31 2034 3034  ...ZHTTP/1.1.404
        0x0040:  204e 6f74 2046 6f75 6e64 0d0a 436f 6e74  .Not.Found..Cont
        0x0050:  656e 742d 4c65 6e67 7468 3a20 300d 0a0d  ent-Length:.0...
        0x0060:  0a                                       .
14:29:02.779992 IP 192.168.100.250.51384 > 192.168.100.247.8082: Flags [.], ack 46, win 229, options [nop,nop,TS val 2363012698 ecr 3753955447], length 0
        0x0000:  4500 0034 9326 4000 4006 5c5b c0a8 64fa  E..4.&@.@.\[..d.
        0x0010:  c0a8 64f7 c8b8 1f92 3d90 8a3f e731 ff6b  ..d.....=..?.1.k
        0x0020:  8010 00e5 a071 0000 0101 080a 8cd8 b65a  .....q.........Z
        0x0030:  dfc0 d077                                ...w
```
Is it normal that the proxied request does not contain /seafhttp/ anymore? I'm not sure about that...
It throws an 404 not found. I tried it with different files to ensure its not just an broken file.

In the logs I found nothing, can I increase verbosity?

Any idea what the problem is?
Thanks!

**Comment by freeplant** [comment]
Asking support question in the forum. This place is for issue tracking.
